{
  "theme": "classic-navy",
  "company": {
    "name": "AstraZeneca / 数字化交付中心",
    "logoText": "AZ",
    "department": "商业技术交付团队"
  },
  "project": {
    "title": "手机端搭建与 Web 端优化项目",
    "reportTitle": "Weekly Report",
    "projectCode": "PRJ-2024-AZ-Q1",
    "period": "Week 16 (2024.04.01 ～ 2024.04.03)",
    "reporter": "项目交付组 (AZ Team)",
    "reportDate": "2024-04-03",
    "confidential": "CONFIDENTIAL · 内部汇报",
    "overallStatusText": "受控推进中",
    "overallStatus": "caution"
  },
  "timeline": {
    "title": "Work Plan —Overview",
    "subtitle": "端到端执行计划及进度跟踪 (W6 - W20)",
    "currentWeek": "W16",
    "weAreHereText": "We are here",
    "weeks": [
      { "id": "W6", "name": "W6", "dates": "1.22-1.26" },
      { "id": "W7", "name": "W7", "dates": "1.29-2.2" },
      { "id": "W8", "name": "W8", "dates": "2.5-2.9" },
      { "id": "W9", "name": "W9", "dates": "2.12-2.16", "isHoliday": true, "holidayName": "春节假期" },
      { "id": "W10", "name": "W10", "dates": "2.19-2.23" },
      { "id": "W11", "name": "W11", "dates": "2.26-3.1" },
      { "id": "W12", "name": "W12", "dates": "3.4-3.8" },
      { "id": "W13", "name": "W13", "dates": "3.11-3.15" },
      { "id": "W14", "name": "W14", "dates": "3.18-3.22" },
      { "id": "W15", "name": "W15", "dates": "3.25-3.29" },
      { "id": "W16", "name": "W16", "dates": "4.1-4.5" },
      { "id": "W17", "name": "W17", "dates": "4.8-4.12" },
      { "id": "W18", "name": "W18", "dates": "4.15-4.19" },
      { "id": "W19", "name": "W19", "dates": "4.22-4.26" },
      { "id": "W20", "name": "W20", "dates": "4.29-5.3" }
    ],
    "tasks": [
      { "workstream": "手机端搭建", "category": "项目启动", "task": "项目启动" },
      { "workstream": "手机端搭建", "category": "需求收集", "task": "手机端接入确认" },
      { "workstream": "手机端搭建", "category": "需求收集", "task": "功能梳理及确认" },
      { "workstream": "手机端搭建", "category": "需求收集", "task": "环境准备", "milestone": "W8" },
      { "workstream": "手机端搭建", "category": "系统设计", "task": "原型设计与确认", "start": "W6", "end": "W7", "status": "completed" },
      { "workstream": "手机端搭建", "category": "系统设计", "task": "高保真确认", "start": "W7", "end": "W8", "status": "completed" },
      {
        "workstream": "手机端搭建",
        "category": "系统开发&测试",
        "task": "系统开发",
        "spans": [
          { "start": "W10", "end": "W13", "status": "completed" },
          { "start": "W14", "end": "W16", "status": "active" }
        ],
        "milestone": "W17"
      },
      {
        "workstream": "手机端搭建",
        "category": "系统开发&测试",
        "task": "掌上AZ集成",
        "spans": [
          { "start": "W12", "end": "W13", "status": "completed" },
          { "start": "W14", "end": "W16", "status": "active" }
        ],
        "milestone": "W18"
      },
      { "workstream": "手机端搭建", "category": "系统开发&测试", "task": "SIT", "start": "W17", "end": "W17", "status": "planned", "milestone": "W8" },
      { "workstream": "手机端搭建", "category": "UAT", "task": "UAT准备", "start": "W16", "end": "W17", "status": "active" },
      { "workstream": "手机端搭建", "category": "UAT", "task": "系统UAT", "start": "W18", "end": "W18", "status": "planned" },
      { "workstream": "手机端搭建", "category": "Go-live", "task": "上线准备&部署", "start": "W18", "end": "W18", "status": "planned" },
      { "workstream": "手机端搭建", "category": "Go-live", "task": "系统上线", "start": "W19", "end": "W19", "status": "planned" },

      { "workstream": "Web端优化", "category": "需求梳理", "task": "功能梳理及确认", "start": "W6", "end": "W6", "status": "completed" },
      { "workstream": "Web端优化", "category": "重点功能设计", "task": "原型设计与确认", "start": "W6", "end": "W8", "status": "completed" },
      { "workstream": "Web端优化", "category": "重点功能设计", "task": "高保真设计与确认", "start": "W7", "end": "W8", "status": "completed", "milestone": "W17" },
      {
        "workstream": "Web端优化",
        "category": "重点功能开发&测试",
        "task": "系统功能搭建",
        "spans": [
          { "start": "W10", "end": "W13", "status": "completed" },
          { "start": "W14", "end": "W16", "status": "active" }
        ],
        "milestone": "W18"
      },
      { "workstream": "Web端优化", "category": "重点功能开发&测试", "task": "SIT", "start": "W17", "end": "W17", "status": "planned" },
      { "workstream": "Web端优化", "category": "其他功能设计", "task": "原型设计与确认", "start": "W15", "end": "W16", "status": "active" },
      { "workstream": "Web端优化", "category": "其他功能设计", "task": "高保真设计与确认", "start": "W16", "end": "W17", "status": "active" },
      { "workstream": "Web端优化", "category": "其他功能开发&测试", "task": "系统功能搭建", "start": "W18", "end": "W20", "status": "planned" },
      { "workstream": "Web端优化", "category": "其他功能开发&测试", "task": "SIT" },
      { "workstream": "Web端优化", "category": "UAT", "task": "UAT准备", "start": "W17", "end": "W17", "status": "planned" },
      { "workstream": "Web端优化", "category": "UAT", "task": "系统UAT", "start": "W18", "end": "W18", "status": "planned" },
      { "workstream": "Web端优化", "category": "Go-live", "task": "上线准备&部署", "start": "W18", "end": "W18", "status": "planned" },
      { "workstream": "Web端优化", "category": "Go-live", "task": "系统上线", "start": "W19", "end": "W19", "status": "planned" }
    ]
  },
  "deliverables": {
    "title": "Deliverables / Output Status",
    "subtitle": "关键交付节点与成果物健康度评估",
    "items": [
      { "milestone": "项目启动", "progress": "已完成", "date": "2023.12.18", "status": "已完成", "risk": "good" },
      { "milestone": "环境确认", "progress": "和掌上 AZ 完成对接方案沟通和确认", "date": "2024.1.5", "status": "已完成", "risk": "good" },
      { "milestone": "需求确认", "progress": "完成功能梳理", "date": "2024.1.5", "status": "已完成", "risk": "good" },
      { "milestone": "手机端&web端重点功能系统设计确认", "progress": "系统设计完成", "date": "2024.2.8", "status": "已完成", "risk": "good" },
      { "milestone": "手机端&web端重点功能系统开发完成", "progress": "完成行业大会和临床研究模块搭建，手机端调整中。", "date": "2024.4.12", "status": "进行中", "risk": "caution" },
      { "milestone": "手机端&web端重点功能系统UAT", "progress": "-", "date": "2024.4.19", "status": "未开始", "risk": "none" },
      { "milestone": "手机端&web端重点功能系统Go-live", "progress": "-", "date": "2024.4.26", "status": "未开始", "risk": "none" },
      { "milestone": "Web端其他功能设计确认", "progress": "-", "date": "2024.4.5", "status": "未开始", "risk": "none" },
      { "milestone": "Web端其他功能开发完成", "progress": "-", "date": "2024.5.30", "status": "未开始", "risk": "none" },
      { "milestone": "Web端其他功能UAT", "progress": "-", "date": "2024.6.8", "status": "未开始", "risk": "none" },
      { "milestone": "Web端其他功能Go-live", "progress": "-", "date": "2024.6.15", "status": "未开始", "risk": "none" }
    ]
  },
  "thisWeek": {
    "title": "Task Management",
    "subtitle": "Week 16：4.1～4.3，2024",
    "overallStatus": "caution",
    "previousTasks": [
      { "tag": "系统开发", "content": "系统开发，手机端功能收尾。" },
      { "tag": "变更处理", "content": "首页设计基于讨论做了更新，待确认。" }
    ],
    "nextSteps": [
      { "tag": "系统实现", "content": "手机端功能联调，掌上AZ&翻译API。" }
    ],
    "risks": [
      { "tag": "", "content": "首页部分功能变更，整体timeline预计4月底前可以完成。" }
    ],
    "milestones": [
      { "name": "-", "date": "-" }
    ]
  },
  "discussionSlides": [
    {
      "title": "方案研讨：掌上 AZ 与第三方翻译 API 架构选型",
      "subtitle": "核心议题与技术方案权衡 (Week 16 决策项)",
      "badge": "方案决策",
      "category": "架构选型",
      "layout": "comparison",
      "columns": 2,
      "cards": [
        {
          "title": "方案 A：企业级自建网关服务 (推荐)",
          "badge": "推荐方案",
          "badgeType": "recommended",
          "summary": "在内网统一接入 API 代理，集中鉴权、缓存、数据脱敏、审计与限流。",
          "items": [
            { "label": "核心优势", "text": "敏感数据不出境与合规内控、降低各端接入复杂度、支持熔断降级。" },
            { "label": "潜在短板", "text": "初期部署需 1.5 周，需配置独立专线与域名证书。" },
            { "label": "资源预估", "text": "后端开发 2 人周，网关运维支持 3 天。" }
          ],
          "verdict": "结论：作为长期标准基础设施首选，符合企业安全基线，建议本期采纳落地。"
        },
        {
          "title": "方案 B：前端直连云端翻译 SDK",
          "badge": "备选方案",
          "badgeType": "alternative",
          "summary": "前端直接集成翻译供应商 SDK，通过短期临时凭证完成调用。",
          "items": [
            { "label": "核心优势", "text": "开发周期短，仅需 2-3 天即可完成全平台上线。" },
            { "label": "潜在短板", "text": "凭证泄露风险高，无法进行集中数据脱敏与调用量审计。" },
            { "label": "资源预估", "text": "前端开发 0.5 人周，免网关开发。" }
          ],
          "verdict": "结论：仅适用于轻量非涉密 PoC，不符合企业安全合规基线，不建议生产采用。"
        }
      ],
      "conclusion": {
        "badge": "周会决议待确认",
        "text": "本周会重点评审自建网关之脱敏合规路径与排期，请架构师 @Leo 与安全顾问 @Sarah 确认准入清单。"
      }
    }
  ]
}

